{
  "test_id": "A-4",
  "tier": "National A",
  "title": "Racing Line & Heavy Braking: Variante del Rettifilo (GT7 A-3)",
  "description": "Approach the first chicane at maximum velocity. Execute threshold braking in a hot hatchback, hop the kerbs cleanly, and accelerate out.",
  "lesson_objective": "Front-wheel drive chicane braking and curb hopping.",
  "car_id": "bmw_m3_e92",
  "track_id": "monza",
  "track_layout": "",
  "start_mode": "ROLLING",
  "spawn": {
    "position": [
      -169.852,
      -6.396,
      37.937
    ],
    "forward_vector": [
      0.1051,
      0.0052,
      -0.9945
    ],
    "initial_speed_kmh": 241.8,
    "gear": 6,
    "rpm": 7339
  },
  "timing": {
    "start_gate": {
      "p1": [
        -146.053,
        -5.36,
        -158.528
      ],
      "p2": [
        -158.009,
        -5.36,
        -159.552
      ]
    },
    "finish_gate": {
      "p1": [
        -93.34,
        -1.486,
        -818.548
      ],
      "p2": [
        -105.264,
        -1.486,
        -819.902
      ]
    }
  },
  "fail_rules": {
    "max_wheels_off": 2,
    "wall_collision_threshold_n": 1500,
    "max_yaw_angle_deg": 90,
    "stop_box_overshoot_fail": false
  },
  "targets": {
    "gold_seconds": 19.3,
    "silver_seconds": 20.7,
    "bronze_seconds": 22.7
  }
}