{
  "test_id": "IA-4",
  "tier": "International A",
  "title": "Classic DTM Aggressive Curb Hopping",
  "description": "Launching over the high yellow curb stones with 12,000 RPM high-downforce AWD touring car.",
  "lesson_objective": "Aggressive curb riding and immediate AWD landing stabilization.",
  "car_id": "ks_alfa_romeo_155_v6",
  "track_id": "imola",
  "track_layout": "",
  "start_mode": "ROLLING",
  "spawn": {
    "position": [
      -717.662,
      -81.111,
      31.208
    ],
    "forward_vector": [
      -0.3422,
      0.0019,
      0.9396
    ],
    "initial_speed_kmh": 55.7,
    "gear": 2,
    "rpm": 4333
  },
  "timing": {
    "start_gate": {
      "p1": [
        -743.446,
        -80.972,
        75.522
      ],
      "p2": [
        -733.637,
        -80.972,
        79.097
      ]
    },
    "finish_gate": {
      "p1": [
        -930.76,
        -73.31,
        471.27
      ],
      "p2": [
        -919.586,
        -73.31,
        465.192
      ]
    }
  },
  "fail_rules": {
    "max_wheels_off": 2,
    "wall_collision_threshold_n": 1500,
    "max_yaw_angle_deg": 90,
    "stop_box_overshoot_fail": false
  },
  "targets": {
    "gold_seconds": 40.7,
    "silver_seconds": 43.6,
    "bronze_seconds": 47.8
  }
}