{
  "test_id": "A-17",
  "tier": "National A",
  "title": "Graduation: Brands Hatch Indy Full Lap",
  "description": "Synthesizes blind drops, hairpin patience, and exit momentum across a complete sub-minute lap.",
  "lesson_objective": "Mastering the undulating Brands Hatch Indy layout in a mid-engine coupe.",
  "car_id": "ks_porsche_718_cayman_s",
  "track_id": "ks_brands_hatch",
  "track_layout": "gp",
  "start_mode": "FLYING_LAP",
  "spawn": {
    "position": [
      -185.032,
      -7.702,
      -369.059
    ],
    "forward_vector": [
      0.9123,
      -0.0333,
      -0.4082
    ],
    "initial_speed_kmh": 130.0
  },
  "timing": {
    "start_gate": {
      "p1": [
        -136.651,
        -7.661,
        -387.201
      ],
      "p2": [
        -141.115,
        -7.661,
        -397.875
      ]
    },
    "finish_gate": {
      "p1": [
        -141.759,
        -7.755,
        -385.078
      ],
      "p2": [
        -146.27,
        -7.755,
        -395.754
      ]
    }
  },
  "fail_rules": {
    "max_wheels_off": 2,
    "wall_collision_threshold_n": 1500,
    "max_yaw_angle_deg": 90,
    "stop_box_overshoot_fail": false
  },
  "targets": {
    "gold_seconds": 52.8,
    "silver_seconds": 56.6,
    "bronze_seconds": 62.0
  }
}