{
  "test_id": "IB-9",
  "tier": "International B",
  "title": "Slipstream Drafting & Clean Overtake",
  "description": "Tucking into the slipstream to gain 15 km/h, pulling out for a clean non-contact pass into Turn 3.",
  "lesson_objective": "High-speed drafting and out-braking without body contact.",
  "car_id": "ks_mazda_mx5_cup",
  "track_id": "ks_red_bull_ring",
  "track_layout": "layout_gp",
  "start_mode": "ROLLING",
  "spawn": {
    "position": [
      60.825,
      -7.104,
      372.886
    ],
    "forward_vector": [
      -0.9511,
      0.0593,
      0.3032
    ],
    "initial_speed_kmh": 65.0,
    "gear": 2,
    "rpm": 5124
  },
  "timing": {
    "start_gate": {
      "p1": [
        -0.538,
        -2.638,
        390.463
      ],
      "p2": [
        3.032,
        -2.638,
        402.463
      ]
    },
    "finish_gate": {
      "p1": [
        -399.89,
        16.768,
        -133.106
      ],
      "p2": [
        -409.549,
        16.768,
        -126.45
      ]
    }
  },
  "fail_rules": {
    "max_wheels_off": 2,
    "wall_collision_threshold_n": 1500,
    "max_yaw_angle_deg": 90,
    "stop_box_overshoot_fail": false
  },
  "targets": {
    "gold_seconds": 36.5,
    "silver_seconds": 39.1,
    "bronze_seconds": 42.8
  }
}