{
  "test_id": "IA-7",
  "tier": "International A",
  "title": "Bus Stop Chicane: Braking from 270 km/h",
  "description": "Maximum braking threshold at 150m board: shift 6-to-1, curb hop right, flick left onto straight.",
  "lesson_objective": "Extreme high-speed threshold deceleration and chicane direction transition.",
  "car_id": "ks_mclaren_650_gt3",
  "track_id": "spa",
  "track_layout": "",
  "start_mode": "ROLLING",
  "spawn": {
    "position": [
      -76.694,
      -2.212,
      69.721
    ],
    "forward_vector": [
      -0.0383,
      0.0256,
      -0.9989
    ],
    "initial_speed_kmh": 128.5,
    "gear": 4,
    "rpm": 5600
  },
  "timing": {
    "start_gate": {
      "p1": [
        -91.575,
        0.055,
        -25.442
      ],
      "p2": [
        -102.785,
        0.055,
        -21.158
      ]
    },
    "finish_gate": {
      "p1": [
        -351.163,
        23.047,
        -798.793
      ],
      "p2": [
        -361.165,
        23.047,
        -792.163
      ]
    }
  },
  "fail_rules": {
    "max_wheels_off": 2,
    "wall_collision_threshold_n": 1500,
    "max_yaw_angle_deg": 90,
    "stop_box_overshoot_fail": false
  },
  "targets": {
    "gold_seconds": 22.0,
    "silver_seconds": 23.5,
    "bronze_seconds": 25.8
  }
}