{
  "test_id": "IB-11",
  "tier": "International B",
  "title": "Blind Crest Downhill Esses: Casanova-Savelli",
  "description": "Right-hand crest into plunging left off-camber descent at Mugello: settle chassis before load shift.",
  "lesson_objective": "Managing high-speed lateral load shifts with simultaneous elevation drops.",
  "car_id": "ks_alfa_giulia_qv",
  "track_id": "mugello",
  "track_layout": "",
  "start_mode": "ROLLING",
  "spawn": {
    "position": [
      -480.023,
      31.232,
      -276.15
    ],
    "forward_vector": [
      0.9966,
      0.0161,
      0.0813
    ],
    "initial_speed_kmh": 110.0,
    "gear": 4,
    "rpm": 3848
  },
  "timing": {
    "start_gate": {
      "p1": [
        -391.29,
        31.173,
        -253.335
      ],
      "p2": [
        -388.668,
        31.173,
        -265.045
      ]
    },
    "finish_gate": {
      "p1": [
        492.247,
        -9.51,
        -60.933
      ],
      "p2": [
        489.727,
        -9.51,
        -72.665
      ]
    }
  },
  "fail_rules": {
    "max_wheels_off": 2,
    "wall_collision_threshold_n": 1500,
    "max_yaw_angle_deg": 90,
    "stop_box_overshoot_fail": false
  },
  "targets": {
    "gold_seconds": 21.0,
    "silver_seconds": 22.5,
    "bronze_seconds": 24.6
  }
}