{
  "test_id": "S-12",
  "tier": "Super License",
  "title": "Formula 1 V10 Apex Velocity: Barcelona GP",
  "description": "19,000 RPM 3.0L V10 F1 car: 4.5+ lateral g through Turn 3 and Campsa. Blistering reaction times.",
  "lesson_objective": "Peak downforce commitment and sub-second decision making in a championship F1 car.",
  "car_id": "ks_ferrari_f2004",
  "track_id": "ks_barcelona",
  "track_layout": "layout_gp",
  "start_mode": "FLYING_LAP",
  "spawn": {
    "position": [
      411.931,
      -17.72,
      -257.84
    ],
    "forward_vector": [
      -0.5721,
      -0.0176,
      0.82
    ],
    "initial_speed_kmh": 200.0
  },
  "timing": {
    "start_gate": {
      "p1": [
        366.752,
        -18.539,
        -195.835
      ],
      "p2": [
        377.535,
        -18.539,
        -188.827
      ]
    },
    "finish_gate": {
      "p1": [
        370.175,
        -18.501,
        -201.04
      ],
      "p2": [
        380.941,
        -18.501,
        -194.005
      ]
    }
  },
  "fail_rules": {
    "max_wheels_off": 2,
    "wall_collision_threshold_n": 1500,
    "max_yaw_angle_deg": 90,
    "stop_box_overshoot_fail": false
  },
  "targets": {
    "gold_seconds": 74.0,
    "silver_seconds": 79.2,
    "bronze_seconds": 86.7
  }
}