{
  "test_id": "B-5",
  "tier": "National B",
  "title": "Low-Speed Weight Transfer & Transition",
  "description": "Trail-brake into Brooklands and smoothly transfer lateral load into the looping Luffield radius.",
  "lesson_objective": "Managing classic live-axle rear-wheel drive chassis dynamics.",
  "car_id": "ks_toyota_ae86",
  "track_id": "ks_silverstone",
  "track_layout": "national",
  "start_mode": "ROLLING",
  "spawn": {
    "position": [
      -30.8,
      2.797,
      -553.214
    ],
    "forward_vector": [
      -0.7562,
      -0.0104,
      -0.6542
    ],
    "initial_speed_kmh": 80.0,
    "gear": 3,
    "rpm": 3825
  },
  "timing": {
    "start_gate": {
      "p1": [
        -74.208,
        1.954,
        -605.641
      ],
      "p2": [
        -83.474,
        1.954,
        -594.088
      ]
    },
    "finish_gate": {
      "p1": [
        -290.859,
        -0.866,
        -693.694
      ],
      "p2": [
        -301.525,
        -0.866,
        -701.538
      ]
    }
  },
  "fail_rules": {
    "max_wheels_off": 2,
    "wall_collision_threshold_n": 1500,
    "max_yaw_angle_deg": 90,
    "stop_box_overshoot_fail": false
  },
  "targets": {
    "gold_seconds": 9.8,
    "silver_seconds": 10.5,
    "bronze_seconds": 11.5
  }
}