{
  "test_id": "B-10",
  "tier": "National B",
  "title": "High-Speed Carousel Feathering",
  "description": "Balancing the car on the edge of adhesion through a long tightening carousel turn.",
  "lesson_objective": "Throttle modulation through the Mercedes Arena carousel.",
  "car_id": "ks_toyota_gt86",
  "track_id": "ks_nurburgring",
  "track_layout": "layout_sprint_a",
  "start_mode": "ROLLING",
  "spawn": {
    "position": [
      -3.874,
      62.753,
      -585.171
    ],
    "forward_vector": [
      0.0076,
      -0.0081,
      0.9999
    ],
    "initial_speed_kmh": 90.0
  },
  "timing": {
    "start_gate": {
      "p1": [
        -6.448,
        62.405,
        -550.153
      ],
      "p2": [
        7.122,
        62.405,
        -550.255
      ]
    },
    "finish_gate": {
      "p1": [
        -94.405,
        54.274,
        -232.295
      ],
      "p2": [
        -106.797,
        54.274,
        -226.336
      ]
    }
  },
  "fail_rules": {
    "max_wheels_off": 2,
    "wall_collision_threshold_n": 1500,
    "max_yaw_angle_deg": 90,
    "stop_box_overshoot_fail": false
  },
  "targets": {
    "gold_seconds": 22.5,
    "silver_seconds": 23.6,
    "bronze_seconds": 25.4
  }
}