{
  "test_id": "IA-1",
  "tier": "International A",
  "title": "The Benchmark: Eau Rouge & Raidillon Flat-Out",
  "description": "Compressing at the bottom of Eau Rouge, flicking right up the 18% hill onto Kemmel Straight.",
  "lesson_objective": "Flat-out high-downforce commitment through motorsport's most famous complex.",
  "car_id": "ks_ferrari_488_gt3",
  "track_id": "spa",
  "track_layout": "",
  "start_mode": "ROLLING",
  "spawn": {
    "position": [
      -437.66,
      27.962,
      -919.269
    ],
    "forward_vector": [
      -0.541,
      0.0398,
      -0.8401
    ],
    "initial_speed_kmh": 180.0
  },
  "timing": {
    "start_gate": {
      "p1": [
        -415.892,
        27.396,
        -952.567
      ],
      "p2": [
        -417.368,
        27.396,
        -971.4
      ]
    },
    "finish_gate": {
      "p1": [
        188.519,
        15.477,
        -423.108
      ],
      "p2": [
        198.078,
        15.477,
        -425.645
      ]
    }
  },
  "fail_rules": {
    "max_wheels_off": 2,
    "wall_collision_threshold_n": 1500,
    "max_yaw_angle_deg": 90,
    "stop_box_overshoot_fail": false
  },
  "targets": {
    "gold_seconds": 14.2,
    "silver_seconds": 14.9,
    "bronze_seconds": 16.0
  }
}