{
  "test_id": "A-14",
  "tier": "National A",
  "title": "Rotary Engine High-RPM Throttle Feathering",
  "description": "Maintaining the twin-rotary in its peak powerband while feathering throttle through Campagnano.",
  "lesson_objective": "High-RPM power delivery control in a lightweight sports car.",
  "car_id": "ks_mazda_rx7_spirit_r",
  "track_id": "ks_vallelunga",
  "track_layout": "classic_circuit",
  "start_mode": "ROLLING",
  "spawn": {
    "position": [
      -237.884,
      187.987,
      13.625
    ],
    "forward_vector": [
      0.9728,
      0.0334,
      0.2291
    ],
    "initial_speed_kmh": 115.0,
    "gear": 4,
    "rpm": 4200
  },
  "timing": {
    "start_gate": {
      "p1": [
        -157.077,
        190.905,
        61.534
      ],
      "p2": [
        -150.328,
        190.905,
        51.673
      ]
    },
    "finish_gate": {
      "p1": [
        401.58,
        192.737,
        81.226
      ],
      "p2": [
        401.375,
        192.737,
        69.468
      ]
    }
  },
  "fail_rules": {
    "max_wheels_off": 2,
    "wall_collision_threshold_n": 1500,
    "max_yaw_angle_deg": 90,
    "stop_box_overshoot_fail": false
  },
  "targets": {
    "gold_seconds": 19.1,
    "silver_seconds": 20.4,
    "bronze_seconds": 22.4
  }
}