{
  "test_id": "IA-10",
  "tier": "International A",
  "title": "Multi-Car GT3 Traffic Overtake",
  "description": "Overtake slower GT4 cars cleanly without body contact before crossing the sector line.",
  "lesson_objective": "Multi-class racecraft, vision placement, and clean non-contact overtaking.",
  "car_id": "ks_ferrari_488_gt3",
  "track_id": "ks_nurburgring",
  "track_layout": "layout_sprint_a",
  "start_mode": "ROLLING",
  "spawn": {
    "position": [
      -84.128,
      50.948,
      -41.331
    ],
    "forward_vector": [
      0.5403,
      -0.0011,
      0.8414
    ],
    "initial_speed_kmh": 89.6,
    "gear": 3,
    "rpm": 4449
  },
  "timing": {
    "start_gate": {
      "p1": [
        -46.559,
        50.161,
        22.454
      ],
      "p2": [
        -37.402,
        50.161,
        16.286
      ]
    },
    "finish_gate": {
      "p1": [
        -388.767,
        35.214,
        -164.418
      ],
      "p2": [
        -399.692,
        35.214,
        -163.43
      ]
    }
  },
  "fail_rules": {
    "max_wheels_off": 2,
    "wall_collision_threshold_n": 1500,
    "max_yaw_angle_deg": 90,
    "stop_box_overshoot_fail": false
  },
  "targets": {
    "gold_seconds": 49.1,
    "silver_seconds": 52.6,
    "bronze_seconds": 57.6
  }
}