{
  "test_id": "S-1",
  "tier": "Super License",
  "title": "Supercar Hot Lap: Laguna Seca",
  "description": "Managing explosive hybrid torque out of Andretti Hairpin and the blind Corkscrew drop.",
  "lesson_objective": "Full unassisted hot lap in a 963 bhp hybrid hypercar.",
  "car_id": "ferrari_laferrari",
  "track_id": "ks_laguna_seca",
  "track_layout": "",
  "start_mode": "FLYING_LAP",
  "spawn": {
    "position": [
      -268.634,
      -12.028,
      -285.516
    ],
    "forward_vector": [
      -0.5636,
      0.002,
      0.8261
    ],
    "initial_speed_kmh": 160.0
  },
  "timing": {
    "start_gate": {
      "p1": [
        -307.451,
        -10.721,
        -237.286
      ],
      "p2": [
        -297.295,
        -10.721,
        -230.894
      ]
    },
    "finish_gate": {
      "p1": [
        -304.73,
        -10.924,
        -241.604
      ],
      "p2": [
        -294.584,
        -10.924,
        -235.196
      ]
    }
  },
  "fail_rules": {
    "max_wheels_off": 2,
    "wall_collision_threshold_n": 1500,
    "max_yaw_angle_deg": 90,
    "stop_box_overshoot_fail": false
  },
  "targets": {
    "gold_seconds": 80.5,
    "silver_seconds": 86.3,
    "bronze_seconds": 94.5
  }
}