{
  "test_id": "IB-3",
  "tier": "International B",
  "title": "Downforce Commitment: Pouhon Double-Apex",
  "description": "Tap brake lightly, tuck into the first apex at 170 km/h, float mid-track, and pull tight for apex 2.",
  "lesson_objective": "High-speed aero downforce commitment through Spa's downhill double-left.",
  "car_id": "lotus_2_eleven",
  "track_id": "spa",
  "track_layout": "",
  "start_mode": "ROLLING",
  "spawn": {
    "position": [
      422.654,
      67.344,
      1002.201
    ],
    "forward_vector": [
      -0.7884,
      -0.048,
      0.6133
    ],
    "initial_speed_kmh": 66.1,
    "gear": 2,
    "rpm": 5215
  },
  "timing": {
    "start_gate": {
      "p1": [
        373.44,
        64.096,
        1037.979
      ],
      "p2": [
        379.363,
        64.096,
        1045.724
      ]
    },
    "finish_gate": {
      "p1": [
        325.65,
        16.248,
        567.076
      ],
      "p2": [
        315.914,
        16.248,
        569.224
      ]
    }
  },
  "fail_rules": {
    "max_wheels_off": 2,
    "wall_collision_threshold_n": 1500,
    "max_yaw_angle_deg": 90,
    "stop_box_overshoot_fail": false
  },
  "targets": {
    "gold_seconds": 39.4,
    "silver_seconds": 42.2,
    "bronze_seconds": 46.2
  }
}