{
  "test_id": "B-6",
  "tier": "National B",
  "title": "Threshold Braking from 190 km/h into Chicane",
  "description": "Heavy straight-line braking at the 150m board down to 60 km/h and hopping the curb cleanly.",
  "lesson_objective": "High-speed threshold braking and curb hopping through Prima Variante.",
  "car_id": "bmw_m3_e30",
  "track_id": "monza",
  "track_layout": "",
  "start_mode": "ROLLING",
  "spawn": {
    "position": [
      -212.184,
      -9.202,
      569.418
    ],
    "forward_vector": [
      -0.0009,
      0.0057,
      -1.0
    ],
    "initial_speed_kmh": 185.0,
    "gear": 5,
    "rpm": 5900
  },
  "timing": {
    "start_gate": {
      "p1": [
        -203.956,
        -8.408,
        414.207
      ],
      "p2": [
        -215.768,
        -8.408,
        413.395
      ]
    },
    "finish_gate": {
      "p1": [
        -101.05,
        -1.684,
        -773.209
      ],
      "p2": [
        -110.692,
        -1.684,
        -773.791
      ]
    }
  },
  "fail_rules": {
    "max_wheels_off": 2,
    "wall_collision_threshold_n": 1500,
    "max_yaw_angle_deg": 90,
    "stop_box_overshoot_fail": false
  },
  "targets": {
    "gold_seconds": 53.4,
    "silver_seconds": 57.2,
    "bronze_seconds": 62.6
  }
}