{
  "test_id": "B-3",
  "tier": "National B",
  "title": "Out-In-Out Hairpin Trajectory",
  "description": "Brake in a straight line, clip the rumble strip late, and open the wheel on exit.",
  "lesson_objective": "Late apex out-in-out line to preserve rolling momentum in a lightweight roadster.",
  "car_id": "ks_mazda_miata",
  "track_id": "ks_vallelunga",
  "track_layout": "club_circuit",
  "start_mode": "ROLLING",
  "spawn": {
    "position": [
      368.986,
      192.303,
      80.637
    ],
    "forward_vector": [
      0.9997,
      0.0127,
      -0.0193
    ],
    "initial_speed_kmh": 70.0,
    "gear": 2,
    "rpm": 5550
  },
  "timing": {
    "start_gate": {
      "p1": [
        427.3,
        193.127,
        81.188
      ],
      "p2": [
        427.068,
        193.127,
        69.58
      ]
    },
    "finish_gate": {
      "p1": [
        417.785,
        191.904,
        213.663
      ],
      "p2": [
        417.934,
        191.904,
        226.252
      ]
    }
  },
  "fail_rules": {
    "max_wheels_off": 2,
    "wall_collision_threshold_n": 1500,
    "max_yaw_angle_deg": 90,
    "stop_box_overshoot_fail": false
  },
  "targets": {
    "gold_seconds": 10.192,
    "silver_seconds": 10.92,
    "bronze_seconds": 11.96
  }
}