{
  "test_id": "IB-5",
  "tier": "International B",
  "title": "Big Displacement V8 Torque Modulation",
  "description": "Steep uphill braking into Turn 1, rolling through Turn 2 Andretti Hairpin without spinning rears.",
  "lesson_objective": "Managing instantaneous naturally aspirated V8 torque off-idle.",
  "car_id": "ks_corvette_c7_stingray",
  "track_id": "ks_laguna_seca",
  "track_layout": "",
  "start_mode": "ROLLING",
  "spawn": {
    "position": [
      -204.176,
      -11.383,
      -379.162
    ],
    "forward_vector": [
      -0.5653,
      -0.0116,
      0.8248
    ],
    "initial_speed_kmh": 82.5,
    "gear": 3,
    "rpm": 3242
  },
  "timing": {
    "start_gate": {
      "p1": [
        -250.493,
        -12.011,
        -328.896
      ],
      "p2": [
        -240.779,
        -12.011,
        -322.179
      ]
    },
    "finish_gate": {
      "p1": [
        -321.426,
        -15.336,
        106.545
      ],
      "p2": [
        -333.425,
        -15.336,
        109.865
      ]
    }
  },
  "fail_rules": {
    "max_wheels_off": 2,
    "wall_collision_threshold_n": 1500,
    "max_yaw_angle_deg": 90,
    "stop_box_overshoot_fail": false
  },
  "targets": {
    "gold_seconds": 24.3,
    "silver_seconds": 26.0,
    "bronze_seconds": 28.5
  }
}